{
  "name": "Richardson Adventure Farm Corn Maze",
  "year": 2026,
  "photo": "map.jpg",
  "board": [
    [
      0,
      0
    ],
    [
      2622,
      0
    ],
    [
      2622,
      1206
    ],
    [
      0,
      1206
    ]
  ],
  "boardSize": [
    2622,
    1206
  ],
  "field": [
    [
      128,
      32
    ],
    [
      2465,
      32
    ],
    [
      2465,
      1115
    ],
    [
      128,
      1115
    ]
  ],
  "openingEdge": [
    [
      1080,
      1115
    ],
    [
      1290,
      1115
    ]
  ],
  "hide": [
    {
      "circle": [
        2341,
        1054,
        60
      ]
    }
  ],
  "points": {
    "entrance": [
      1180,
      1100
    ],
    "exit": [
      1180,
      1100
    ]
  },
  "ground": [
    {
      "sign": [
        128,
        32
      ],
      "lat": 42.466355,
      "lon": -88.213847
    },
    {
      "sign": [
        2465,
        32
      ],
      "lat": 42.466343,
      "lon": -88.219759
    },
    {
      "sign": [
        2465,
        1115
      ],
      "lat": 42.468358,
      "lon": -88.219705
    },
    {
      "sign": [
        128,
        1115
      ],
      "lat": 42.468342,
      "lon": -88.213831
    }
  ]
}